{
    "task_packet_id": "0001+0002",
    "status": "pass",
    "summary": "Implemented Case Bundle Schemas and Bundle Export functionality.",
    "changes": [
        "Added schemas/case_bundle.schema.json",
        "Added schemas/implementer_report.schema.json",
        "Added schemas/supervisor_review.schema.json",
        "Added src/taskx/pipeline/bundle/exporter.py",
        "Added taskx_bundle.yaml",
        "Updated src/taskx/cli.py to include 'bundle' command group"
    ],
    "verification": {
        "steps": [
            {
                "name": "Schema Loading Tests",
                "result": "pass",
                "output": "pytest tests/unit/utils/test_schema_loading_new.py -> 3 passed"
            },
            {
                "name": "Bundle Exporter Tests",
                "result": "pass",
                "output": "pytest tests/unit/bundle/test_exporter.py -> 3 passed"
            },
            {
                "name": "Manual Export Verification",
                "result": "pass",
                "output": "python -m taskx.cli bundle export --last 1 --case-id CASE_VERIFY_0002_RETRY -> Bundle exported to out/test_bundle/CASE_VERIFY_0002_RETRY.zip"
            }
        ],
        "artifacts": [
            "out/test_bundle/CASE_VERIFY_0002_RETRY.zip"
        ]
    },
    "artifacts": [
        "taskx_schemas/case_bundle.schema.json",
        "src/taskx/pipeline/bundle/exporter.py",
        "taskx_bundle.yaml"
    ],
    "deviations": []
}